{
  "contract_name": "paper-order-v1",
  "schema_version": "1.0.0",
  "producer_version": "1.0.0",
  "data_as_of": "2026-07-24T06:00:00Z",
  "created_at": "2026-07-24T06:25:00Z",
  "source_hashes": [
    {
      "source": "paper-intent-and-market-rules",
      "sha256": "2323232323232323232323232323232323232323232323232323232323232323"
    }
  ],
  "paper_order_id": "paper-order-000001",
  "origin_ref": {
    "contract_name": "evaluation-origin-v1",
    "artifact_id": "evaluation-origin-000001",
    "schema_version": "1.0.0",
    "sha256": "56596f5d6623db64f7aa1ad9aafc27f52fd0c3d8d94408648e8c34ee0decbda9",
    "created_at": "2026-07-24T06:15:00Z"
  },
  "intent_ref": {
    "contract_name": "paper-intent-v1",
    "artifact_id": "paper-intent-000001",
    "schema_version": "1.0.0",
    "sha256": "56ad779b43b37718024cb161d20b301a91976558a55a062fd2eee9a366ad9c49",
    "created_at": "2026-07-24T06:20:00Z"
  },
  "fill_model_ref": {
    "contract_name": "fill-model-v1",
    "artifact_id": "fill-model-paper-asx-001",
    "schema_version": "1.0.0",
    "sha256": "fb2bee438b467de76ebc6ad35be2f386c9effd4601911326873f322aa03c8b41",
    "created_at": "2026-07-24T06:05:00Z"
  },
  "branch_id": "PROPOSAL_BASE",
  "asset_id": "XASX:BHP",
  "side": "BUY",
  "order_type": "LIMIT",
  "quantity": "200",
  "limit_price_aud": "50.000000",
  "tick_size_aud": "0.010000",
  "board_lot_quantity": "1",
  "knowledge_cutoff": "2026-07-24T05:59:00Z",
  "intent_recorded_at": "2026-07-24T06:20:00Z",
  "order_recorded_at": "2026-07-24T06:25:00Z",
  "first_eligible_market_event_at": "2026-07-27T00:00:00Z",
  "expires_at": "2026-07-31T06:00:00Z",
  "max_volume_participation": "0.050000",
  "state": "RECORDED",
  "canonical_hash": {
    "canonicalization": "RFC8785",
    "hash_algorithm": "SHA-256",
    "excluded_json_pointer": "/canonical_hash/payload_sha256",
    "payload_sha256": "1dd26ffc9d828630fd432a437ab88b0c5cc332eeb5abf21c0e9c887eda302533"
  },
  "controls": {
    "evaluation_mode": "PAPER_ONLY",
    "simulated": true,
    "non_executable": true,
    "same_session_fill_allowed": false,
    "broker_capability": "ABSENT"
  }
}
